<?xml version="1.0" encoding="UTF-8"?>

<!-- You can switch to the Visual Editor -->

<?xml-stylesheet type="text/css" href="personal.css"?>

<personnel xsi:noNamespaceSchemaLocation="personal.xsd" xmlns:xsi="http://www.w3.org/2001/XMLSchema-instance">
	<person contr="false" id="Big.Boss">
		<name>
			<family>Boss</family>
			<given>Great</given>
		</name>
		<email>bossdd@foo.com</email>
		<link subordinates="one.worker two.worker three.worker four.worker five.worker"/>
	</person>
	<person contr="false" id="one.worker">
		<name>
			<family>Worker 1</family>
			<given>One</given>
		</name>
		<email>one@fdddddsddddoo.com</email>
		<link manager="Big.Boss"/>
	</person>
	<person contr="false" id="two.worker">
		<name>
			<family>Worker 2</family>
			<given>Two</given>
		</name>
		
		<email>two@foo.com</email>
		<link manager="Big.Boss"/>
	</person>
	<person contr="false" id="three.worker">
		<name>
			<family>Worker 3</family>
			<given>Three</given>
		</name>
		<email>three@foo.com</email>
		<link manager="Big.Boss"/>
	</person>
	<person contr="false" id="four.worker">
		<name>
			<family>Worker 4</family>
			<given>Four</given>
		</name>
		<email>four@foo.com</email>
		<link manager="Big.Boss"/>
	</person>
	<person contr="false" id="five.worker">
		<name>
			<family>Worker 5</family>
			<given>Five</given>
		</name>
		<email>five@foo.com</email>
		<link manager="Big.Boss"/>
	</person>
</personnel>
